"year","name","rating"
2009,"Crazy Love: Overwhelmed by a Relentless God",4.7
2009,"Liberty and Tyranny: A Conservative Manifesto",4.8
2009,"The Last Olympian (Percy Jackson and the Olympians, Book 5)",4.8
2009,"The Time Traveler's Wife",4.4
2009,"Where the Wild Things Are",4.8
2009,"The Lost Symbol",4.2
2009,"The 5000 Year Leap",4.8
2009,"The Love Dare",4.8
2009,"Eclipse (Twilight)",4.7
2009,"Eclipse (Twilight Sagas)",4.7
2009,"Dead And Gone: A Sookie Stackhouse Novel (Sookie Stackhouse/True Blood)",4.6
2009,"Super Freakonomics: Global Cooling, Patriotic Prostitutes, and Why Suicide Bombers Should Buy Life Insurance",4.5
2009,"Eat This, Not That! Thousands of Simple Food Swaps that Can Save You 10, 20, 30 Pounds--or More!",4.3
2009,"Eat This Not That! Supermarket Survival Guide: The No-Diet Weight Loss Solution",4.5
2009,"The 7 Habits of Highly Effective People: Powerful Lessons in Personal Change",4.6
2009,"The Shack: Where Tragedy Confronts Eternity",4.6
2009,"Dog Days (Diary of a Wimpy Kid, Book 4) (Volume 4)",4.8
2009,"Under the Dome: A Novel",4.3
2009,"The Book of Basketball: The NBA According to The Sports Guy",4.7
2009,"Divine Soul Mind Body Healing and Transmission System: The Divine Way to Heal You, Humanity, Mother Earth, and All…",4.6
2009,"Diary of a Wimpy Kid: The Last Straw (Book 3)",4.8
2009,"Publication Manual of the American Psychological Association, 6th Edition",4.5
2009,"Mastering the Art of French Cooking, Vol. 2",4.8
2009,"Watchmen",4.8
2009,"Act Like a Lady, Think Like a Man: What Men Really Think About Love, Relationships, Intimacy, and Commitment",4.6
2009,"The Elegance of the Hedgehog",4.0
2009,"Sookie Stackhouse",4.7
2009,"I, Alex Cross",4.6
2009,"Twilight (The Twilight Saga, Book 1)",4.7
2009,"The Five Dysfunctions of a Team: A Leadership Fable",4.6
2009,"The Five Love Languages: How to Express Heartfelt Commitment to Your Mate",4.6
2009,"True Compass: A Memoir",4.5
2009,"Have a Little Faith: A True Story",4.8
2009,"Outliers: The Story of Success",4.6
2009,"Three Cups of Tea: One Man's Mission to Promote Peace - One School at a Time",4.3
2009,"The Girl Who Played with Fire (Millennium)",4.7
2009,"The Girl with the Dragon Tattoo (Millennium Series)",4.4
2009,"The Guernsey Literary and Potato Peel Pie Society",4.7
2009,"Breaking Dawn (The Twilight Saga, Book 4)",4.6
2009,"StrengthsFinder 2.0",4.0
2009,"The Help",4.8
2009,"Good to Great: Why Some Companies Make the Leap and Others Don't",4.5
2009,"Going Rogue: An American Life",4.6
2009,"Arguing with Idiots: How to Stop Small Minds and Big Government",4.6
2009,"The Twilight Saga Collection",4.7
2009,"New Moon (The Twilight Saga)",4.6
2009,"Olive Kitteridge",4.2
2009,"Glenn Beck's Common Sense: The Case Against an Out-of-Control Government, Inspired by Thomas Paine",4.6
2009,"The Last Lecture",4.7
2009,"The Tipping Point: How Little Things Can Make a Big Difference",4.4
2010,"StrengthsFinder 2.0",4.0
2010,"Outliers: The Story of Success",4.6
2010,"Sh*t My Dad Says",4.7
2010,"Sarah's Key",4.6
2010,"Percy Jackson and the Olympians Paperback Boxed Set (Books 1-3)",4.8
2010,"Radical: Taking Back Your Faith from the American Dream",4.7
2010,"Publication Manual of the American Psychological Association, 6th Edition",4.5
2010,"Autobiography of Mark Twain, Vol. 1",4.2
2010,"Towers of Midnight (Wheel of Time, Book Thirteen)",4.8
2010,"Barefoot Contessa, How Easy Is That?: Fabulous Recipes & Easy Tips",4.7
2010,"Three Cups of Tea: One Man's Mission to Promote Peace - One School at a Time",4.3
2010,"Broke: The Plan to Restore Our Trust, Truth and Treasure",4.5
2010,"The Ugly Truth (Diary of a Wimpy Kid, Book 5)",4.8
2010,"Women Food and God: An Unexpected Path to Almost Everything",4.2
2010,"Catching Fire (The Hunger Games)",4.7
2010,"Crazy Love: Overwhelmed by a Relentless God",4.7
2010,"Cutting for Stone",4.6
2010,"Dead in the Family (Sookie Stackhouse/True Blood, Book 10)",4.3
2010,"The Short Second Life of Bree Tanner: An Eclipse Novella (The Twilight Saga)",4.6
2010,"Decision Points",4.6
2010,"Delivering Happiness: A Path to Profits, Passion, and Purpose",4.6
2010,"The Road to Serfdom: Text and Documents--The Definitive Edition (The Collected Works of F. A. Hayek, Volume 2)",4.6
2010,"The Red Pyramid (The Kane Chronicles, Book 1)",4.6
2010,"Drive: The Surprising Truth About What Motivates Us",4.5
2010,"The Official SAT Study Guide",4.4
2010,"The Lost Hero (Heroes of Olympus, Book 1)",4.8
2010,"The Last Olympian (Percy Jackson and the Olympians, Book 5)",4.8
2010,"Food Rules: An Eater's Manual",4.4
2010,"Game Change: Obama and the Clintons, McCain and Palin, and the Race of a Lifetime",4.4
2010,"George Washington's Sacred Fire",4.5
2010,"The Immortal Life of Henrietta Lacks",4.7
2010,"The Hunger Games",4.7
2010,"Good to Great: Why Some Companies Make the Leap and Others Don't",4.5
2010,"The Help",4.8
2010,"A Patriot's History of the United States: From Columbus's Great Discovery to the War on Terror",4.6
2010,"The Girl with the Dragon Tattoo (Millennium Series)",4.4
2010,"The Girl Who Played with Fire (Millennium Series)",4.7
2010,"The Girl Who Kicked the Hornet's Nest (Millennium Trilogy)",4.7
2010,"The Five Dysfunctions of a Team: A Leadership Fable",4.6
2010,"The Daily Show with Jon Stewart Presents Earth (The Book): A Visitor's Guide to the Human Race",4.4
2010,"The Confession: A Novel",4.3
2010,"The Big Short: Inside the Doomsday Machine",4.7
2010,"The Art of Racing in the Rain: A Novel",4.7
2010,"Life",4.5
2010,"Little Bee: A Novel",4.1
2010,"Unbroken: A World War II Story of Survival, Resilience, and Redemption",4.8
2010,"The 5 Love Languages: The Secret to Love That Lasts",4.7
2010,"Teach Like a Champion: 49 Techniques that Put Students on the Path to College",4.4
2010,"Switch: How to Change Things When Change Is Hard",4.6
2010,"Mockingjay (The Hunger Games)",4.5
2011,"Thinking, Fast and Slow",4.6
2011,"The Art of Racing in the Rain: A Novel",4.7
2011,"Killing Lincoln: The Shocking Assassination that Changed America Forever (Bill O'Reilly's Killing Series)",4.7
2011,"The Lego Ideas Book: Unlock Your Imagination",4.4
2011,"Publication Manual of the American Psychological Association, 6th Edition",4.5
2011,"Water for Elephants: A Novel",4.5
2011,"Love Wins: A Book About Heaven, Hell, and the Fate of Every Person Who Ever Lived",4.2
2011,"The Throne of Fire (The Kane Chronicles, Book 2)",4.7
2011,"Steve Jobs",4.6
2011,"The Girl Who Kicked the Hornet's Nest (Millennium Trilogy)",4.7
2011,"Tina Fey: Bossypants",4.3
2011,"Heaven is for Real: A Little Boy's Astounding Story of His Trip to Heaven and Back",4.7
2011,"The Official SAT Study Guide",4.4
2011,"Eat to Live: The Amazing Nutrient-Rich Program for Fast and Sustained Weight Loss, Revised Edition",4.5
2011,"Jesus Calling: Enjoying Peace in His Presence (with Scripture References)",4.9
2011,"The Immortal Life of Henrietta Lacks",4.7
2011,"A Stolen Life: A Memoir",4.6
2011,"The China Study: The Most Comprehensive Study of Nutrition Ever Conducted And the Startling Implications for Diet…",4.7
2011,"The 4 Hour Body: An Uncommon Guide to Rapid Fat Loss, Incredible Sex and Becoming Superhuman",4.3
2011,"The Five Dysfunctions of a Team: A Leadership Fable",4.6
2011,"Mockingjay (The Hunger Games)",4.5
2011,"One Thousand Gifts: A Dare to Live Fully Right Where You Are",4.6
2011,"Inheritance: Book IV (Inheritance Cycle)",4.6
2011,"What to Expect When You're Expecting",4.4
2011,"In the Garden of Beasts: Love, Terror, and an American Family in Hitler's Berlin",4.4
2011,"The Dukan Diet: 2 Steps to Lose the Weight, 2 Steps to Keep It Off Forever",4.1
2011,"The 5 Love Languages: The Secret to Love That Lasts",4.7
2011,"The Hunger Games Trilogy Boxed Set (1)",4.8
2011,"Crazy Love: Overwhelmed by a Relentless God",4.7
2011,"The Hunger Games (Book 1)",4.7
2011,"The 17 Day Diet: A Doctor's Plan Designed for Rapid Results",4.3
2011,"Catching Fire (The Hunger Games)",4.7
2011,"The Paris Wife: A Novel",4.3
2011,"Go the F**k to Sleep",4.8
2011,"Cabin Fever (Diary of a Wimpy Kid, Book 6)",4.8
2011,"Cutting for Stone",4.6
2011,"StrengthsFinder 2.0",4.0
2011,"Dead Reckoning (Sookie Stackhouse/True Blood, Book 11)",4.2
2011,"The Help",4.8
2011,"11/22/63: A Novel",4.6
2011,"Teach Like a Champion: 49 Techniques that Put Students on the Path to College",4.4
2011,"Good to Great: Why Some Companies Make the Leap and Others Don't",4.5
2011,"The Son of Neptune (Heroes of Olympus, Book 2)",4.8
2011,"The Help",4.8
2011,"A Dance with Dragons (A Song of Ice and Fire)",4.4
2011,"Radical: Taking Back Your Faith from the American Dream",4.7
2011,"The Litigators",4.4
2011,"The 7 Habits of Highly Effective People: Powerful Lessons in Personal Change",4.6
2011,"Unbroken: A World War II Story of Survival, Resilience, and Redemption",4.8
2011,"Game of Thrones Boxed Set: A Game of Thrones/A Clash of Kings/A Storm of Swords/A Feast for Crows",4.6
2012,"The Third Wheel (Diary of a Wimpy Kid, Book 7)",4.7
2012,"The 5 Love Languages: The Secret to Love That Lasts",4.7
2012,"The Lego Ideas Book: Unlock Your Imagination",4.4
2012,"Fifty Shades Darker",4.4
2012,"Fifty Shades Freed: Book Three of the Fifty Shades Trilogy (Fifty Shades of Grey Series) (English Edition)",4.5
2012,"Fifty Shades of Grey: Book One of the Fifty Shades Trilogy (Fifty Shades of Grey Series)",3.8
2012,"Fifty Shades Trilogy (Fifty Shades of Grey / Fifty Shades Darker / Fifty Shades Freed)",4.5
2012,"Catching Fire (The Hunger Games)",4.7
2012,"Oh, the Places You'll Go!",4.9
2012,"Game of Thrones Boxed Set: A Game of Thrones/A Clash of Kings/A Storm of Swords/A Feast for Crows",4.6
2012,"One Thousand Gifts: A Dare to Live Fully Right Where You Are",4.6
2012,"The Immortal Life of Henrietta Lacks",4.7
2012,"The Hunger Games Trilogy Boxed Set (1)",4.8
2012,"The Hunger Games (Book 1)",4.7
2012,"Gone Girl",4.0
2012,"Wheat Belly: Lose the Wheat, Lose the Weight, and Find Your Path Back to Health",4.4
2012,"Good to Great: Why Some Companies Make the Leap and Others Don't",4.5
2012,"Goodnight, Goodnight Construction Site (Hardcover Books for Toddlers, Preschool Books for Kids)",4.9
2012,"The Harbinger: The Ancient Mystery that Holds the Secret of America's Future",4.6
2012,"The Great Gatsby",4.4
2012,"Thinking, Fast and Slow",4.6
2012,"Thomas Jefferson: The Art of Power",4.5
2012,"Heaven is for Real: A Little Boy's Astounding Story of His Trip to Heaven and Back",4.7
2012,"Steve Jobs",4.6
2012,"Barefoot Contessa Foolproof: Recipes You Can Trust: A Cookbook",4.8
2012,"The Five Dysfunctions of a Team: A Leadership Fable",4.6
2012,"The Fault in Our Stars",4.7
2012,"Quiet: The Power of Introverts in a World That Can't Stop Talking",4.6
2012,"Publication Manual of the American Psychological Association, 6th Edition",4.5
2012,"Mockingjay (The Hunger Games)",4.5
2012,"Jesus Calling: Enjoying Peace in His Presence (with Scripture References)",4.9
2012,"The Casual Vacancy",3.3
2012,"Killing Kennedy: The End of Camelot",4.6
2012,"Killing Lincoln: The Shocking Assassination that Changed America Forever (Bill O'Reilly's Killing Series)",4.7
2012,"Proof of Heaven: A Neurosurgeon's Journey into the Afterlife",4.3
2012,"The Blood Sugar Solution: The UltraHealthy Program for Losing Weight, Preventing Disease, and Feeling Great Now!",4.2
2012,"Unbroken: A World War II Story of Survival, Resilience, and Redemption",4.8
2012,"The Amateur",4.6
2012,"The 7 Habits of Highly Effective People: Powerful Lessons in Personal Change",4.6
2012,"StrengthsFinder 2.0",4.0
2012,"No Easy Day: The Autobiography of a Navy Seal: The Firsthand Account of the Mission That Killed Osama Bin Laden",4.6
2012,"Winter of the World: Book Two of the Century Trilogy",4.5
2012,"Wild: From Lost to Found on the Pacific Crest Trail",4.4
2012,"The Serpent's Shadow (The Kane Chronicles, Book 3)",4.8
2012,"The Racketeer",4.3
2012,"The Power of Habit: Why We Do What We Do in Life and Business",4.6
2012,"The Pioneer Woman Cooks: Food from My Frontier",4.8
2012,"The Official SAT Study Guide",4.4
2012,"Eat to Live: The Amazing Nutrient-Rich Program for Fast and Sustained Weight Loss, Revised Edition",4.5
2012,"The Mark of Athena (Heroes of Olympus, Book 3)",4.8
2013,"David and Goliath: Underdogs, Misfits, and the Art of Battling Giants",4.4
2013,"Daring Greatly: How the Courage to Be Vulnerable Transforms the Way We Live, Love, Parent, and Lead",4.8
2013,"The Pioneer Woman Cooks: A Year of Holidays: 140 Step-by-Step Recipes for Simple, Scrumptious Celebrations",4.8
2013,"StrengthsFinder 2.0",4.0
2013,"The Great Gatsby",4.4
2013,"Knock-Knock Jokes for Kids",4.5
2013,"The House of Hades (Heroes of Olympus, Book 4)",4.8
2013,"Soul Healing Miracles: Ancient and New Sacred Wisdom, Knowledge, and Practical Techniques for Healing the Spiritual…",4.6
2013,"The Official SAT Study Guide",4.4
2013,"Laugh-Out-Loud Jokes for Kids",4.6
2013,"And the Mountains Echoed",4.3
2013,"The 7 Habits of Highly Effective People: Powerful Lessons in Personal Change",4.6
2013,"Allegiant",3.9
2013,"Goodnight, Goodnight Construction Site (Hardcover Books for Toddlers, Preschool Books for Kids)",4.9
2013,"Lean In: Women, Work, and the Will to Lead",4.5
2013,"Quiet: The Power of Introverts in a World That Can't Stop Talking",4.6
2013,"Things That Matter: Three Decades of Passions, Pastimes and Politics [Deckled Edge]",4.7
2013,"Rush Revere and the Brave Pilgrims: Time-Travel Adventures with Exceptional Americans (1)",4.9
2013,"George Washington's Secret Six: The Spy Ring That Saved the American Revolution",4.6
2013,"Game of Thrones Boxed Set: A Game of Thrones/A Clash of Kings/A Storm of Swords/A Feast for Crows",4.6
2013,"Wonder",4.8
2013,"Diary of a Wimpy Kid: Hard Luck, Book 8",4.8
2013,"Wheat Belly: Lose the Wheat, Lose the Weight, and Find Your Path Back to Health",4.4
2013,"Oh, the Places You'll Go!",4.9
2013,"The 5 Love Languages: The Secret to Love That Lasts",4.7
2013,"Divergent",4.6
2013,"The Very Hungry Caterpillar",4.9
2013,"Shred: The Revolutionary Diet: 6 Weeks 4 Inches 2 Sizes",4.1
2013,"Publication Manual of the American Psychological Association, 6th Edition",4.5
2013,"Hyperbole and a Half: Unfortunate Situations, Flawed Coping Mechanisms, Mayhem, and Other Things That Happened",4.7
2013,"Diagnostic and Statistical Manual of Mental Disorders, 5th Edition: DSM-5",4.5
2013,"The Fault in Our Stars",4.7
2013,"Inferno",4.1
2013,"Humans of New York",4.8
2013,"The Day the Crayons Quit",4.8
2013,"Doctor Sleep: A Novel",4.7
2013,"To Kill a Mockingbird",4.8
2013,"The Five Dysfunctions of a Team: A Leadership Fable",4.6
2013,"The Four Agreements: A Practical Guide to Personal Freedom (A Toltec Wisdom Book)",4.7
2013,"The Legend of Zelda: Hyrule Historia",4.9
2013,"Jesus Calling: Enjoying Peace in His Presence (with Scripture References)",4.9
2013,"Sycamore Row (Jake Brigance)",4.5
2013,"Gone Girl",4.0
2013,"The Book Thief",4.6
2013,"The Goldfinch: A Novel (Pulitzer Prize for Fiction)",3.9
2013,"Joyland (Hard Case Crime)",4.5
2013,"Proof of Heaven: A Neurosurgeon's Journey into the Afterlife",4.3
2013,"Killing Jesus (Bill O'Reilly's Killing Series)",4.5
2013,"Fifty Shades of Grey: Book One of the Fifty Shades Trilogy (Fifty Shades of Grey Series)",3.8
2013,"Happy, Happy, Happy: My Life and Legacy as the Duck Commander",4.8
2014,"The Blood of Olympus (The Heroes of Olympus (5))",4.8
2014,"A Game of Thrones / A Clash of Kings / A Storm of Swords / A Feast of Crows / A Dance with Dragons",4.7
2014,"All the Light We Cannot See",4.6
2014,"Capital in the Twenty First Century",4.5
2014,"Diagnostic and Statistical Manual of Mental Disorders, 5th Edition: DSM-5",4.5
2014,"Diary of a Wimpy Kid: The Long Haul",4.8
2014,"Divergent",4.6
2014,"Divergent / Insurgent",4.5
2014,"First 100 Words",4.7
2014,"Frozen (Little Golden Book)",4.7
2014,"Gone Girl",4.0
2014,"Grain Brain: The Surprising Truth about Wheat, Carbs, and Sugar--Your Brain's Silent Killers",4.6
2014,"How to Win Friends & Influence People",4.7
2014,"Humans of New York",4.8
2014,"If I Stay",4.3
2014,"Jesus Calling: Enjoying Peace in His Presence (with Scripture References)",4.9
2014,"JOURNEY TO THE ICE P",4.6
2014,"Killing Patton: The Strange Death of World War II's Most Audacious General (Bill O'Reilly's Killing Series)",4.6
2014,"Knock-Knock Jokes for Kids",4.5
2014,"Laugh-Out-Loud Jokes for Kids",4.6
2014,"Little Blue Truck",4.9
2014,"Looking for Alaska",4.5
2014,"Love You Forever",4.8
2014,"Make It Ahead: A Barefoot Contessa Cookbook",4.5
2014,"Mindset: The New Psychology of Success",4.6
2014,"Oh, the Places You'll Go!",4.9
2014,"Orphan Train",4.6
2014,"Publication Manual of the American Psychological Association, 6th Edition",4.5
2014,"Rush Revere and the First Patriots: Time-Travel Adventures With Exceptional Americans (2)",4.9
2014,"StrengthsFinder 2.0",4.0
2014,"The 5 Love Languages: The Secret to Love That Lasts",4.7
2014,"The Alchemist",4.7
2014,"The Book Thief",4.6
2014,"The Book with No Pictures",4.8
2014,"The Boys in the Boat: Nine Americans and Their Epic Quest for Gold at the 1936 Berlin Olympics",4.8
2014,"The Day the Crayons Quit",4.8
2014,"The Fault in Our Stars",4.7
2014,"The Fault in Our Stars",4.7
2014,"The Goldfinch: A Novel (Pulitzer Prize for Fiction)",3.9
2014,"The Great Gatsby",4.4
2014,"The Maze Runner (Book 1)",4.5
2014,"The Official SAT Study Guide",4.4
2014,"The Very Hungry Caterpillar",4.9
2014,"Thug Kitchen: The Official Cookbook: Eat Like You Give a F*ck (Thug Kitchen Cookbooks)",4.6
2014,"To Kill a Mockingbird",4.8
2014,"Ultimate Sticker Book: Frozen: More Than 60 Reusable Full-Color Stickers",4.5
2014,"Unbroken: A World War II Story of Survival, Resilience, and Redemption",4.8
2014,"Unbroken: A World War II Story of Survival, Resilience, and Redemption",4.8
2014,"What If?: Serious Scientific Answers to Absurd Hypothetical Questions",4.7
2014,"Wonder",4.8
2015,"What Pet Should I Get? (Classic Seuss)",4.7
2015,"Creative Haven Creative Cats Coloring Book (Adult Coloring)",4.8
2015,"Creative Haven Owls Coloring Book (Adult Coloring)",4.8
2015,"Dear Zoo: A Lift-the-Flap Book",4.8
2015,"Go Set a Watchman: A Novel",3.6
2015,"The Pioneer Woman Cooks: Dinnertime - Comfort Classics, Freezer Food, 16-minute Meals, and Other Delicious Ways to Solve…",4.8
2015,"Dover Creative Haven Art Nouveau Animal Designs Coloring Book (Creative Haven Coloring Books)",4.6
2015,"Adult Coloring Book: Stress Relieving Patterns",4.4
2015,"Giraffes Can't Dance",4.8
2015,"The 5 Love Languages: The Secret to Love that Lasts",4.8
2015,"The Nightingale: A Novel",4.8
2015,"The Martian",4.7
2015,"First 100 Words",4.7
2015,"Enchanted Forest: An Inky Quest and Coloring book (Activity Books, Mindfulness and Meditation, Illustrated Floral Prints…",4.7
2015,"The Life-Changing Magic of Tidying Up: The Japanese Art of Decluttering and Organizing",4.5
2015,"Old School (Diary of a Wimpy Kid #10)",4.8
2015,"Adult Coloring Books: A Coloring Book for Adults Featuring Mandalas and Henna Inspired Flowers, Animals, and Paisley…",4.5
2015,"Laugh-Out-Loud Jokes for Kids",4.6
2015,"The 7 Habits of Highly Effective People: Powerful Lessons in Personal Change",4.7
2015,"Publication Manual of the American Psychological Association, 6th Edition",4.5
2015,"StrengthsFinder 2.0",4.0
2015,"All the Light We Cannot See",4.6
2015,"Knock-Knock Jokes for Kids",4.5
2015,"American Sniper: The Autobiography of the Most Lethal Sniper in U.S. Military History",4.6
2015,"Killing Reagan: The Violent Assault That Changed a Presidency (Bill O'Reilly's Killing Series)",4.6
2015,"Baby Touch and Feel: Animals",4.6
2015,"The Book with No Pictures",4.8
2015,"The Boys in the Boat: Nine Americans and Their Epic Quest for Gold at the 1936 Berlin Olympics",4.8
2015,"Jesus Calling: Enjoying Peace in His Presence (with Scripture References)",4.9
2015,"To Kill a Mockingbird",4.8
2015,"Balance (Angie's Extreme Stress Menders)",4.6
2015,"Secret Garden: An Inky Treasure Hunt and Coloring Book (For Adults, mindfulness coloring)",4.7
2015,"Thug Kitchen: The Official Cookbook: Eat Like You Give a F*ck (Thug Kitchen Cookbooks)",4.6
2015,"Being Mortal: Medicine and What Matters in the End",4.8
2015,"The Day the Crayons Quit",4.8
2015,"Between the World and Me",4.7
2015,"Humans of New York : Stories",4.9
2015,"The Wright Brothers",4.7
2015,"Mindset: The New Psychology of Success",4.6
2015,"How to Win Friends & Influence People",4.7
2015,"Grey: Fifty Shades of Grey as Told by Christian (Fifty Shades of Grey Series)",4.4
2015,"The Four Agreements: A Practical Guide to Personal Freedom (A Toltec Wisdom Book)",4.7
2015,"The Whole30: The 30-Day Guide to Total Health and Food Freedom",4.6
2015,"The Girl on the Train",4.1
2015,"Harry Potter Coloring Book",4.7
2015,"The Very Hungry Caterpillar",4.9
2015,"Oh, the Places You'll Go!",4.9
2015,"Wonder",4.8
2015,"Adult Coloring Book: Stress Relieving Animal Designs",4.6
2015,"Love You Forever",4.8
2016,"Cravings: Recipes for All the Food You Want to Eat: A Cookbook",4.7
2016,"To Kill a Mockingbird",4.8
2016,"The Four Agreements: A Practical Guide to Personal Freedom (A Toltec Wisdom Book)",4.7
2016,"Adult Coloring Book Designs: Stress Relief Coloring Book: Garden Designs, Mandalas, Animals, and Paisley Patterns",4.5
2016,"Uninvited: Living Loved When You Feel Less Than, Left Out, and Lonely",4.7
2016,"Dear Zoo: A Lift-the-Flap Book",4.8
2016,"Harry Potter and the Cursed Child, Parts 1 & 2, Special Rehearsal Edition Script",4.0
2016,"The Very Hungry Caterpillar",4.9
2016,"The Official SAT Study Guide, 2016 Edition (Official Study Guide for the New Sat)",4.3
2016,"Double Down (Diary of a Wimpy Kid #11)",4.8
2016,"Thug Kitchen: The Official Cookbook: Eat Like You Give a F*ck (Thug Kitchen Cookbooks)",4.6
2016,"The Nightingale: A Novel",4.8
2016,"Oh, the Places You'll Go!",4.9
2016,"Giraffes Can't Dance",4.8
2016,"The Constitution of the United States",4.8
2016,"Calm the F*ck Down: An Irreverent Adult Coloring Book (Irreverent Book Series)",4.6
2016,"Wonder",4.8
2016,"The Girl on the Train",4.1
2016,"The 5 Love Languages: The Secret to Love that Lasts",4.8
2016,"First 100 Words",4.7
2016,"Hillbilly Elegy: A Memoir of a Family and Culture in Crisis",4.4
2016,"The Magnolia Story",4.9
2016,"Harry Potter Paperback Box Set (Books 1-7)",4.8
2016,"Publication Manual of the American Psychological Association, 6th Edition",4.5
2016,"The Life-Changing Magic of Tidying Up: The Japanese Art of Decluttering and Organizing",4.5
2016,"Between the World and Me",4.7
2016,"Fahrenheit 451",4.6
2016,"Fantastic Beasts and Where to Find Them: The Original Screenplay (Harry Potter)",4.7
2016,"You Are a Badass: How to Stop Doubting Your Greatness and Start Living an Awesome Life",4.7
2016,"Harry Potter and the Chamber of Secrets: The Illustrated Edition (Harry Potter, Book 2)",4.9
2016,"Alexander Hamilton",4.8
2016,"Night (Night)",4.7
2016,"Pokémon Deluxe Essential Handbook: The Need-to-Know Stats and Facts on Over 700 Pokémon",4.7
2016,"Laugh-Out-Loud Jokes for Kids",4.6
2016,"Born to Run",4.7
2016,"Mindset: The New Psychology of Success",4.6
2016,"The 7 Habits of Highly Effective People: Powerful Lessons in Personal Change",4.7
2016,"Harry Potter and the Sorcerer's Stone: The Illustrated Edition (Harry Potter, Book 1)",4.9
2016,"The Wonderful Things You Will Be",4.9
2016,"Milk and Honey",4.7
2016,"How to Win Friends & Influence People",4.7
2016,"Hamilton: The Revolution",4.9
2016,"Killing the Rising Sun: How America Vanquished World War II Japan (Bill O'Reilly's Killing Series)",4.8
2016,"10-Day Green Smoothie Cleanse",4.7
2016,"The Whole30: The 30-Day Guide to Total Health and Food Freedom",4.6
2016,"The Going-To-Bed Book",4.8
2016,"StrengthsFinder 2.0",4.0
2016,"Jesus Calling: Enjoying Peace in His Presence (with Scripture References)",4.9
2016,"A Man Called Ove: A Novel",4.6
2016,"When Breath Becomes Air",4.8
2017,"Option B: Facing Adversity, Building Resilience, and Finding Joy",4.5
2017,"Obama: An Intimate Portrait",4.9
2017,"StrengthsFinder 2.0",4.0
2017,"Milk and Vine: Inspirational Quotes From Classic Vines",4.4
2017,"Milk and Honey",4.7
2017,"Make Your Bed: Little Things That Can Change Your Life...And Maybe the World",4.7
2017,"The 5 Love Languages: The Secret to Love that Lasts",4.8
2017,"Leonardo da Vinci",4.5
2017,"Laugh-Out-Loud Jokes for Kids",4.6
2017,"The 7 Habits of Highly Effective People: Powerful Lessons in Personal Change",4.7
2017,"A Man Called Ove: A Novel",4.6
2017,"Killers of the Flower Moon: The Osage Murders and the Birth of the FBI",4.6
2017,"Oh, the Places You'll Go!",4.9
2017,"If Animals Kissed Good Night",4.8
2017,"A Gentleman in Moscow: A Novel",4.7
2017,"How to Win Friends & Influence People",4.7
2017,"Hillbilly Elegy: A Memoir of a Family and Culture in Crisis",4.4
2017,"The Four Agreements: A Practical Guide to Personal Freedom (A Toltec Wisdom Book)",4.7
2017,"The Getaway",4.8
2017,"Harry Potter and the Prisoner of Azkaban: The Illustrated Edition (Harry Potter, Book 3)",4.9
2017,"The Going-To-Bed Book",4.8
2017,"1984 (Signet Classics)",4.7
2017,"The Handmaid's Tale",4.3
2017,"Goodnight Moon",4.8
2017,"Giraffes Can't Dance",4.8
2017,"The Instant Pot Electric Pressure Cooker Cookbook: Easy Recipes for Fast & Healthy Meals",4.3
2017,"First 100 Words",4.7
2017,"The Life-Changing Magic of Tidying Up: The Japanese Art of Decluttering and Organizing",4.5
2017,"The Pout-Pout Fish",4.8
2017,"Dog Man: A Tale of Two Kitties: From the Creator of Captain Underpants (Dog Man #3)",4.9
2017,"Dear Zoo: A Lift-the-Flap Book",4.8
2017,"The Shack: Where Tragedy Confronts Eternity",4.6
2017,"The Subtle Art of Not Giving a F*ck: A Counterintuitive Approach to Living a Good Life",4.6
2017,"The Sun and Her Flowers",4.7
2017,"The Very Hungry Caterpillar",4.9
2017,"The Whole30: The 30-Day Guide to Total Health and Food Freedom",4.6
2017,"The Wonderful Things You Will Be",4.9
2017,"Brown Bear, Brown Bear, What Do You See?",4.9
2017,"Thirteen Reasons Why",4.5
